{
  "r0c0": {
    "action": "none",
    "entity": "",
    "target_page": ""
  },
  "r0c1": {
    "action": "none",
    "entity": "",
    "target_page": ""
  },
  "r0c2": {
    "action": "none",
    "entity": "",
    "target_page": ""
  },
  "r0c3": {
    "action": "none",
    "entity": "",
    "target_page": ""
  },
  "r1c0": {
    "action": "none",
    "entity": "",
    "target_page": ""
  },
  "r1c1": {
    "action": "none",
    "entity": "",
    "target_page": ""
  },
  "r1c2": {
    "action": "none",
    "entity": "",
    "target_page": ""
  },
  "r1c3": {
    "action": "none",
    "entity": "",
    "target_page": ""
  },
  "r2c0": {
    "action": "none",
    "entity": "",
    "target_page": ""
  },
  "r2c1": {
    "action": "none",
    "entity": "",
    "target_page": ""
  },
  "r2c2": {
    "action": "none",
    "entity": "",
    "target_page": ""
  },
  "r2c3": {
    "action": "none",
    "entity": "",
    "target_page": ""
  },
  "enc_up": {
    "action": "none",
    "entity": "",
    "target_page": ""
  },
  "enc_down": {
    "action": "none",
    "entity": "",
    "target_page": ""
  }
}
